"DESCRIPTION","DURATION IN MS","NAME","PARENT SUITE","START TIME","STATUS","STOP TIME","SUB SUITE","SUITE","TEST CLASS","TEST METHOD"
"","7071","should researcher sign up successfully with valid details","User sign-up functionality","Sun Jun 08 00:58:15 UTC 2025","passed","Sun Jun 08 00:58:22 UTC 2025","","","",""
"","10442","should load the home page and display main elements","Home Page Load Test","Sun Jun 08 00:57:55 UTC 2025","failed","Sun Jun 08 00:58:06 UTC 2025","","","",""
"","6951","should display an error message when signing in with invalid credentials","User sign-in functionality","Sun Jun 08 00:58:24 UTC 2025","passed","Sun Jun 08 00:58:30 UTC 2025","","","",""
"","5806","should display an error message when signing in with not activated resercher user","User sign-in functionality","Sun Jun 08 00:58:34 UTC 2025","passed","Sun Jun 08 00:58:40 UTC 2025","","","",""
"","3273","should general user sign in successfully with valid credentials","User sign-in functionality","Sun Jun 08 00:58:31 UTC 2025","passed","Sun Jun 08 00:58:34 UTC 2025","","","",""
"","7984","should general user sign up successfully with valid details","User sign-up functionality","Sun Jun 08 00:58:07 UTC 2025","passed","Sun Jun 08 00:58:15 UTC 2025","","","",""
