"DESCRIPTION","DURATION IN MS","NAME","PARENT SUITE","START TIME","STATUS","STOP TIME","SUB SUITE","SUITE","TEST CLASS","TEST METHOD"
"","9943","should load the home page and display main elements","Home Page Load Test","Mon May 12 00:53:50 UTC 2025","failed","Mon May 12 00:54:00 UTC 2025","","","",""
"","3037","should general user sign in successfully with valid credentials","User sign-in functionality","Mon May 12 00:54:23 UTC 2025","passed","Mon May 12 00:54:26 UTC 2025","","","",""
"","6043","should researcher sign up successfully with valid details","User sign-up functionality","Mon May 12 00:54:09 UTC 2025","passed","Mon May 12 00:54:15 UTC 2025","","","",""
"","7973","should general user sign up successfully with valid details","User sign-up functionality","Mon May 12 00:54:01 UTC 2025","passed","Mon May 12 00:54:09 UTC 2025","","","",""
"","6041","should display an error message when signing in with not activated resercher user","User sign-in functionality","Mon May 12 00:54:26 UTC 2025","passed","Mon May 12 00:54:33 UTC 2025","","","",""
"","6943","should display an error message when signing in with invalid credentials","User sign-in functionality","Mon May 12 00:54:16 UTC 2025","passed","Mon May 12 00:54:23 UTC 2025","","","",""
