"DESCRIPTION","DURATION IN MS","NAME","PARENT SUITE","START TIME","STATUS","STOP TIME","SUB SUITE","SUITE","TEST CLASS","TEST METHOD"
"","5966","should display an error message when signing in with invalid credentials","User sign-in functionality","Thu Mar 27 00:47:42 UTC 2025","passed","Thu Mar 27 00:47:48 UTC 2025","","","",""
"","5206","should display an error message when signing in with not activated resercher user","User sign-in functionality","Thu Mar 27 00:47:51 UTC 2025","passed","Thu Mar 27 00:47:56 UTC 2025","","","",""
"","4851","should load the home page and display main elements","Home Page Load Test","Thu Mar 27 00:47:24 UTC 2025","passed","Thu Mar 27 00:47:29 UTC 2025","","","",""
"","2850","should general user sign in successfully with valid credentials","User sign-in functionality","Thu Mar 27 00:47:48 UTC 2025","passed","Thu Mar 27 00:47:51 UTC 2025","","","",""
"","5047","should researcher sign up successfully with valid details","User sign-up functionality","Thu Mar 27 00:47:36 UTC 2025","passed","Thu Mar 27 00:47:41 UTC 2025","","","",""
"","5946","should general user sign up successfully with valid details","User sign-up functionality","Thu Mar 27 00:47:30 UTC 2025","passed","Thu Mar 27 00:47:36 UTC 2025","","","",""
