"DESCRIPTION","DURATION IN MS","NAME","PARENT SUITE","START TIME","STATUS","STOP TIME","SUB SUITE","SUITE","TEST CLASS","TEST METHOD"
"","7967","should display an error message when signing in with invalid credentials","User sign-in functionality","Sat Apr 26 00:48:06 UTC 2025","passed","Sat Apr 26 00:48:14 UTC 2025","","","",""
"","4044","should general user sign in successfully with valid credentials","User sign-in functionality","Sat Apr 26 00:48:14 UTC 2025","passed","Sat Apr 26 00:48:18 UTC 2025","","","",""
"","7052","should researcher sign up successfully with valid details","User sign-up functionality","Sat Apr 26 00:47:51 UTC 2025","passed","Sat Apr 26 00:47:58 UTC 2025","","","",""
"","5240","should load the home page and display main elements","Home Page Load Test","Sat Apr 26 00:48:00 UTC 2025","passed","Sat Apr 26 00:48:05 UTC 2025","","","",""
"","11965","should general user sign up successfully with valid details","User sign-up functionality","Sat Apr 26 00:47:39 UTC 2025","passed","Sat Apr 26 00:47:51 UTC 2025","","","",""
"","7056","should display an error message when signing in with not activated resercher user","User sign-in functionality","Sat Apr 26 00:48:19 UTC 2025","passed","Sat Apr 26 00:48:26 UTC 2025","","","",""
