"DESCRIPTION","DURATION IN MS","NAME","PARENT SUITE","START TIME","STATUS","STOP TIME","SUB SUITE","SUITE","TEST CLASS","TEST METHOD"
"","4112","should general user sign in successfully with valid credentials","User sign-in functionality","Sat May 24 00:49:29 UTC 2025","passed","Sat May 24 00:49:33 UTC 2025","","","",""
"","7970","should display an error message when signing in with invalid credentials","User sign-in functionality","Sat May 24 00:49:21 UTC 2025","passed","Sat May 24 00:49:29 UTC 2025","","","",""
"","9242","should load the home page and display main elements","Home Page Load Test","Sat May 24 00:49:11 UTC 2025","failed","Sat May 24 00:49:20 UTC 2025","","","",""
"","8083","should researcher sign up successfully with valid details","User sign-up functionality","Sat May 24 00:49:01 UTC 2025","passed","Sat May 24 00:49:09 UTC 2025","","","",""
"","6984","should display an error message when signing in with not activated resercher user","User sign-in functionality","Sat May 24 00:49:33 UTC 2025","passed","Sat May 24 00:49:40 UTC 2025","","","",""
"","12922","should general user sign up successfully with valid details","User sign-up functionality","Sat May 24 00:48:48 UTC 2025","passed","Sat May 24 00:49:01 UTC 2025","","","",""
