"DESCRIPTION","DURATION IN MS","NAME","PARENT SUITE","START TIME","STATUS","STOP TIME","SUB SUITE","SUITE","TEST CLASS","TEST METHOD"
"","8995","should general user sign up successfully with valid details","User sign-up functionality","Thu May 01 00:56:21 UTC 2025","passed","Thu May 01 00:56:30 UTC 2025","","","",""
"","7590","should load the home page and display main elements","Home Page Load Test","Thu May 01 00:56:12 UTC 2025","passed","Thu May 01 00:56:20 UTC 2025","","","",""
"","3961","should general user sign in successfully with valid credentials","User sign-in functionality","Thu May 01 00:56:46 UTC 2025","passed","Thu May 01 00:56:50 UTC 2025","","","",""
"","7075","should researcher sign up successfully with valid details","User sign-up functionality","Thu May 01 00:56:30 UTC 2025","passed","Thu May 01 00:56:37 UTC 2025","","","",""
"","7964","should display an error message when signing in with invalid credentials","User sign-in functionality","Thu May 01 00:56:38 UTC 2025","passed","Thu May 01 00:56:46 UTC 2025","","","",""
"","6126","should display an error message when signing in with not activated resercher user","User sign-in functionality","Thu May 01 00:56:50 UTC 2025","passed","Thu May 01 00:56:57 UTC 2025","","","",""
