"DESCRIPTION","DURATION IN MS","NAME","PARENT SUITE","START TIME","STATUS","STOP TIME","SUB SUITE","SUITE","TEST CLASS","TEST METHOD"
"","5977","should load the home page and display main elements","Home Page Load Test","Fri Apr 18 00:48:15 UTC 2025","passed","Fri Apr 18 00:48:21 UTC 2025","","","",""
"","7651","should researcher sign up successfully with valid details","User sign-up functionality","Fri Apr 18 00:48:31 UTC 2025","failed","Fri Apr 18 00:48:38 UTC 2025","","","",""
"","2974","should general user sign in successfully with valid credentials","User sign-in functionality","Fri Apr 18 00:48:47 UTC 2025","passed","Fri Apr 18 00:48:50 UTC 2025","","","",""
"","8559","should general user sign up successfully with valid details","User sign-up functionality","Fri Apr 18 00:48:22 UTC 2025","failed","Fri Apr 18 00:48:31 UTC 2025","","","",""
"","5081","should display an error message when signing in with not activated resercher user","User sign-in functionality","Fri Apr 18 00:48:50 UTC 2025","passed","Fri Apr 18 00:48:55 UTC 2025","","","",""
"","6932","should display an error message when signing in with invalid credentials","User sign-in functionality","Fri Apr 18 00:48:40 UTC 2025","passed","Fri Apr 18 00:48:47 UTC 2025","","","",""
