"DESCRIPTION","DURATION IN MS","NAME","PARENT SUITE","START TIME","STATUS","STOP TIME","SUB SUITE","SUITE","TEST CLASS","TEST METHOD"
"","5069","should display an error message when signing in with not activated resercher user","User sign-in functionality","Tue Apr 15 00:49:48 UTC 2025","passed","Tue Apr 15 00:49:53 UTC 2025","","","",""
"","6915","should display an error message when signing in with invalid credentials","User sign-in functionality","Tue Apr 15 00:49:38 UTC 2025","passed","Tue Apr 15 00:49:45 UTC 2025","","","",""
"","7974","should general user sign up successfully with valid details","User sign-up functionality","Tue Apr 15 00:49:22 UTC 2025","passed","Tue Apr 15 00:49:30 UTC 2025","","","",""
"","6051","should researcher sign up successfully with valid details","User sign-up functionality","Tue Apr 15 00:49:30 UTC 2025","passed","Tue Apr 15 00:49:36 UTC 2025","","","",""
"","6065","should load the home page and display main elements","Home Page Load Test","Tue Apr 15 00:49:15 UTC 2025","passed","Tue Apr 15 00:49:21 UTC 2025","","","",""
"","2991","should general user sign in successfully with valid credentials","User sign-in functionality","Tue Apr 15 00:49:45 UTC 2025","passed","Tue Apr 15 00:49:48 UTC 2025","","","",""
